{
  "schema_version": 1,
  "minimum_reader_version": "0.4.0",
  "project_id": "project-p",
  "annotations": [{
    "id": "summary-1", "project_id": "project-p", "annotation_kind": "milestone_conclusion_candidate", "status": "pending",
    "text": "The bounded visible answer concluded the milestone.", "generation_id": "generation-1", "schema_version": 1,
    "analysis_profile": "milestone-summary-v1", "agent_run_id": "run-1",
    "dependencies": [{ "kind": "source_turn", "revision_id": "turn-1", "digest": "sha256:1111111111111111111111111111111111111111111111111111111111111111" }],
    "revision": 1, "created_at": "2026-09-04T00:00:00Z", "confirmed_entity_id": null,
    "target_milestone_id": "milestone-1", "prompt_schema_version": "milestone-conclusion-v1"
  }],
  "extraction_runs": [{
    "run_id": "run-1", "project_id": "project-p", "status": "completed", "extractor_version": "extractor-v1",
    "prompt_schema_version": "milestone-conclusion-v1", "dependency_digests": ["sha256:1111111111111111111111111111111111111111111111111111111111111111"],
    "created_at": "2026-09-04T00:00:00Z", "updated_at": "2026-09-04T00:00:01Z"
  }]
}
